,,,,,,,,,,
Trajectory Transformers,"GPT, Control Transformers” (not per se a family, but grouping here those transformers that try to model more general control, RL-like, tasks)",Decoder,predict most likely sequence,"Similarly to the Decision transformers, the main extension introduced by Trajectory Transformers is a way to encode a trajectory (state, actions, rewards) ",General RL (reinforcement learning tasks),6//2021,Smaller architecture than GPT,D4RL dataset and other RL datasets depending on the task at hand,,UC Berkeley
Transformer XL,Transformer,Decoder,LM,Relative positioned embeddings enable longer-context attention when compared to vanilla Transformer model,General language tasks,1//2019,151M,"Different training datasets depending on experiments, but baseline is Wikitext-103",,CMU/Google
Turing-NLG,GPT,Decoder,LM,Optimized version of GPT2 with optimal hyperparameters and software/hardware platform to improve training,Same as GPT-2/3,2//2020,"17B originally, up to 530B more recently",Highest quality subset from The Pile + 2 CC snapshots (339B tokens),,Microsoft
UL2,Transformer,Encoder/Decoder,"Mixture-of-Denoisers, which combines diverse pre-training paradigms together",UL2-20B (Unifying Language Learning) can be interpreted as a model that is quite similar to T5 but trained with a different objective and slightly different scaling knobs.,A unified framework for pre-training models that are universally effective across datasets and setups.,5//2022,20B,1 trillion tokens on C4,"Open, Apache-2.0",Google
Vicuna,LLaMA,Decoder,human instructions,LLaMA fine-tuned on user-shared conversations collected from ShareGPT.,Same as ChatGPT,3//2023,13B,Conversations collected from ShareGPT,"Limited, Non-commercial bespoke license","UC Berkeley, CMU, Stanford, UC San Diego, and MBZUAI"
VIT,BERT,Encoder,Image Classification,Extension of BERT architecture to train on patches of images ,mage classification,10//2020,86M(Base) to 632M (Huge), From standard Imagenet to JFT-300M (large inhouse dataset),,Google
Wu Dao 2.0,GLM (General Language Model),Decoder,Autoregressive blank infilling,"Similar to GPT in that it uses a Decoder/autoregressive architecture but applies a different pretraining task proposed in the GLM family of models. Besides, Wu Dao uses a “Fast Mixture of Experts” approach to scale training to trillions of parameters",Language and multimodal (particularly image),6//2021,1.75T,N/A,,Beijing Academy of Artificial Intelligence
XLM-RoBERTa,RoBERTa,Encoder,MLM (Dynamic),An extension of RoBERTa that introduces small parameter tuning insights in the context of multilingual applications,Translation and other cross-lingual language tasks,10//2019,"Base = 270M
Large = 550M",Cleaned Common Crawl in 100 languages,,Facebook
XLNet,Transformer XL,Decoder,PLM,This model basically adapts Transformer XL architecture to permutation-based LM,General language tasks,5//2019,"Base=117M, Large=360M","Same as BERT + Giga5 (16GB text),
and and aggressively filtered ClueWeb 2012-B (19GB), Common Crawl (110 GB)",,CMU/Google